
2505,O CÓDIGO COBRADO É DIFERENTE DO CÓDIGO AUTORIZADO,11/16/2006,,11/16/2006
2506,A QUANTIDADE DE SESSÕES COBRADAS É DIFERENTE DA QUANTIDADE AUTORIZADA,11/16/2006,,11/16/2006
2507,O CÓDIGO AUTORIZADO ESTÁ INCOMPATÍVEL COM A PRESCRIÇÃO MÉDICA SOLICITADA,11/16/2006,,11/16/2006
2508,"COBRANÇA DE SESSÕES SEM O DEVIDO PLANO DE TRATAMENTO E, OU, COM O PRAZO DE PAGAMENTO EXPIRADO",11/16/2006,,11/16/2006
2509,COBRANÇA DO PROCEDIMENTO SERIADO INCOMPATÍVEL COM O QUADRO CLÍNICO,11/16/2006,,11/16/2006
2510,COBRANÇA DO PROCEDIMENTO SERIADO EM NÚMERO DE SESSÕES ACIMA DA QUANTIDADE ESTABELECIDA,11/16/2006,,11/16/2006
2511,AUSÊNCIA DE EVOLUÇÃO NO PRONTUÁRIO MÉDICO DO TRATAMENTO SERIADO REALIZADO.,11/16/2006,,11/16/2006
2512,COBRANÇA DE SESSÕES DE FISIOTERAPIA EM DESACORDO COM AS EVOLUÇÕES DO PRONTUÁRIO MÉDICO,11/16/2006,,11/16/2006
2513,COBRANÇA DE TRATAMENTO SERIADO SEM JUSTIFICATIVA CLÍNICA/TÉCNICA,11/16/2006,,11/16/2006
2514,SERVIÇO NÃO CONTRATADO PARA O PRESTADOR,11/16/2006,,11/16/2006
2515,LOCAL DE ATENDIMENTO INADEQUADO,11/16/2006,,11/16/2006
2516,QUANTIDADE COBRADA DIFERENTE DA REALIZADA,11/16/2006,,11/16/2006
2601,CODIFICAÇÃO INCORRETA/INADEQUADA DO PROCEDIMENTO.,11/16/2006,,11/16/2006
2602,COBRANÇA DE HONORÁRIO INCLUSO NO PROCEDIMENTO PRINCIPAL,11/16/2006,,11/16/2006
2603,COBRANÇA DE HONORÁRIO SEM REGISTRO DA EFETIVA PARTICIPAÇÃO DO PROFISSIONAL,11/16/2006,,11/16/2006
2604,PROCEDIMENTO PRINCIPAL NÃO REQUER EQUIPE MÉDICA,11/16/2006,,11/16/2006
2605,NÃO CABE PAGAMENTO DO HONORÁRIO INTEGRAL POR SER A MESMA VIA DE ACESSO CIRÚRGICO.,11/16/2006,,11/16/2006
2606,COBRANÇA DO HONORÁRIO EM LOCAL DE ATENDIMENTO INCORRETO (INEXISTENTE).,11/16/2006,,11/16/2006
2607,COBRANÇA DE HONORÁRIOS EM DUPLICIDADE.,11/16/2006,,11/16/2006
2608,"COBRANÇA DE CONSULTA INDEVIDA, QUANDO O PROCEDIMENTO PRINCIPAL JÁ ESTÁ SENDO REMUNERADO.",11/16/2006,,11/16/2006
2609,LOCAL DE ATENDIMENTO NÃO INFORMADO.,11/16/2006,,11/16/2006
2610,GRAU DE PARTICIPAÇÃO DE AUXILIAR INCOMPATÍVEL COM PROCEDIMENTO COBRADO,10/10/2012,,8/31/2014
2611,COBRANÇA DE ESPECIALISTA NÃO JUSTIFICADA NO EVENTO,10/10/2012,,8/31/2014
2612,"COBRANÇA INDEVIDA DE EQUIPE ""STAND-BY"", JÁ QUE ANGIOPLASTIA SEGUIDA DE CIRURGIA CARDÍACA",10/10/2012,,8/31/2014
2613,"HONORÁRIO MÉDICO DO ANESTESISTA JÁ LIBERADO NO PROCEDIMENTO CIRÚRGICO, POIS ""ANALGESIA POR DIA SUBSEQUENTE"" COBRADA NA MESMA DATA DO EVENTO CIRÚRGICO",10/10/2012,,8/31/2014
2614,COBRANÇA DE CADA PARTICIPANTE DA EQUIPE DEVE SER FEITA EM GUIAS DIFERENTES,10/10/2012,,8/31/2014
2702,COBRANÇA DE EXAME NÃO SOLICITADO PELO MÉDICO,11/16/2006,,11/16/2006
2703,EXAME SEM REGISTRO DE EXECUÇÃO,11/16/2006,,11/16/2006
2704,COBRANÇA DE EXAME NÃO CORRELACIONADO AO RELATÓRIO ESPECÍFICO,11/16/2006,,11/16/2006
2705,COBRANÇA DE PROCEDIMENTO/EXAME SEM JUSTIFICATIVA PARA REALIZAÇÃO OU COM JUSTIFICATIVA INSUFICIENTE.,11/16/2006,,11/16/2006
2706,COBRANÇA DE PROCEDIMENTO/EXAME COM DATA DE AUTORIZAÇÃO POSTERIOR À DO ATENDIMENTO.,11/16/2006,,11/16/2006
2707,EXAME NÃO AUTORIZADO,11/16/2006,,11/16/2006
2708,COBRANÇA DE EXAME EM QUANTIDADE INCOMPATÍVEL COM O PROCEDIMENTO/EVOLUÇÃO CLÍNICA,11/16/2006,,11/16/2006
2710,COBRANÇA DE EXAME QUE EXIGE AUTORIZAÇÃO PRÉVIA,11/16/2006,,11/16/2006
2711,COBRANÇA DE EXAME COM HISTÓRIA CLÍNICA/HIPÓTESE DIAGNÓSTICA NÃO COMPATÍVEL,11/16/2006,,11/16/2006
2712,COBRANÇA DE EXAME EM QUANTIDADE ACIMA DA MÁXIMA PERMITIDA/AUTORIZADA,11/16/2006,,11/16/2006
2713,COBRANÇA DE EXAME NÃO COMPATÍVEL COM A IDADE.,11/16/2006,,11/16/2006
2714,COBRANÇA DE EXAME COM AUSÊNCIA DE RESULTADO OU LAUDO TÉCNICO.,11/16/2006,,11/16/2006
2715,"EXAME REALIZADO PELO MESMO PROFISSIONAL, NA MESMA ESPECIALIDADE, NO PRAZO INFERIOR AO ESTIPULADO SEM JUSTIFICATIVA ADEQUADA.",11/16/2006,,11/16/2006
2716,EXAME COBRADO NÃO CORRESPONDE AO EXAME EXECUTADO,11/16/2006,,11/16/2006
2717,COBRANÇA DE EXAME AMBULATORIAL COM DATA DE AUTORIZAÇÃO POSTERIOR À DO ATENDIMENTO.,11/16/2006,,11/16/2006
2718,EXAMES NÃO JUSTIFICAM CARÁTER DE URGÊNCIA,11/16/2006,,11/16/2006
2801,PACOTE INVÁLIDO,11/16/2006,,11/16/2006
2802,PACOTE INCOMPATÍVEL COM O SEXO DO BENEFICIÁRIO,11/16/2006,,11/16/2006
2803,IDADE DO BENEFICIÁRIO INCOMPATÍVEL COM O PACOTE,11/16/2006,,11/16/2006
2804,VALOR TOTAL DO PACOTE DIFERENTE DO VALOR PROCESSADO,11/16/2006,,11/16/2006
2805,VALOR DO PACOTE SUPERIOR AO VALOR DOS ITENS,11/16/2006,,11/16/2006
2806,COBRANÇA DE PACOTE NÃO EXECUTADO,11/16/2006,,11/16/2006
2807,COBRANÇA DE PACOTE NÃO SOLICITADO PELO MÉDICO,11/16/2006,,11/16/2006
2808,PACOTE SEM REGISTRO DE EXECUÇÃO,11/16/2006,,11/16/2006
2809,COBRANÇA DE PACOTE NÃO CORRELACIONADO AO RELATÓRIO ESPECÍFICO,11/16/2006,,11/16/2006
2810,COBRANÇA DE PACOTE SEM JUSTIFICATIVA PARA REALIZAÇÃO OU COM JUSTIFICATIVA INSUFICIENTE.,11/16/2006,,11/16/2006
2811,COBRANÇA DE PACOTE COM DATA DE AUTORIZAÇÃO POSTERIOR À DO ATENDIMENTO.,11/16/2006,,11/16/2006
2812,PACOTE NÃO AUTORIZADO,11/16/2006,,11/16/2006
2813,COBRANÇA DE PACOTE EM QUANTIDADE INCOMPATÍVEL COM O PROCEDIMENTO/EVOLUÇÃO CLÍNICA,11/16/2006,,11/16/2006
2814,ITENS DE COMPOSIÇÃO DO PACOTE NÃO REALIZADOS,11/16/2006,,11/16/2006
2815,COBRANÇA DO PACOTE EXIGE AUTORIZAÇÃO PRÉVIA,11/16/2006,,11/16/2006
2816,COBRANÇA DE PACOTE COM HISTÓRIA CLÍNICA/HIPÓTESE DIAGNÓSTICA NÃO COMPATÍVEL,11/16/2006,,11/16/2006
2817,COBRANÇA DE PACOTE EM QUANTIDADE ACIMA DA MÁXIMA PERMITIDA/AUTORIZADA,11/16/2006,,11/16/2006
2818,COBRANÇA DE PACOTE NÃO COMPATÍVEL COM A IDADE.,11/16/2006,,11/16/2006
2819,COBRANÇA DE PACOTE COM AUSÊNCIA DE RESULTADO OU LAUDO TÉCNICO.,11/16/2006,,11/16/2006
2820,"PACOTE REALIZADO PELO MESMO PROFISSIONAL, NA MESMA ESPECIALIDADE, NO PRAZO INFERIOR AO ESTIPULADO SEM JUSTIFICATIVA ADEQUADA.",11/16/2006,,11/16/2006
2821,PACOTE COBRADO NÃO CORRESPONDE AO EXAME EXECUTADO,11/16/2006,,11/16/2006
2822,COBRANÇA DE PACOTE AMBULATORIAL COM DATA DE AUTORIZAÇÃO POSTERIOR À DO ATENDIMENTO.,11/16/2006,,11/16/2006
2901,REVISÃO DE GLOSA INVÁLIDA,11/16/2006,,11/16/2006
2902,GLOSA MANTIDA,11/16/2006,,11/16/2006
2903,PEDIDO DE REVISÃO SEM JUSTIFICATIVA,11/16/2006,,11/16/2006
2904,MAIS DE UM RECURSO DE GLOSA PARA A MESMA GUIA/PROTOCOLO,11/16/2006,,11/16/2006
2905,A GUIA NÃO É DE REVISÃO,11/16/2006,,11/16/2006
2907,PRAZO DE 180 DIAS ULTRAPASSADO PARA SOLICITAÇÃO DE REANÁLISE,10/10/2012,,8/31/2014
2908,SOLICITAÇÃO DE REANÁLISE EFETUADA DE FORMA INCORRETA ,10/10/2012,,8/31/2014
2909,PRAZO PARA SOLICITAÇÃO DE RECURSO DE GLOSA PRESCRITO,4/1/2013,,8/31/2014
3001,PROCEDIMENTO ODONTOLÓGICO INVÁLIDO,5/11/2007,,5/11/2007
3002,COBRANÇA DE PROCEDIMENTO ODONTOLÓGICO QUE EXIGE AUTORIZAÇÃO PRÉVIA,5/11/2007,,5/11/2007
3003,IDADE DO BENEFICIÁRIO INCOMPATÍVEL COM O PROCEDIMENTO ODONTOLÓGICO,5/11/2007,,5/11/2007
3004,COBRANÇA DE PROCEDIMENTO ODONTOLÓGICO EM QUANTIDADE ACIMA DA MÁXIMA PERMITIDA/AUTORIZADA,5/11/2007,,5/11/2007
3007,PROCEDIMENTOS ODONTOLÓGICOS DUPLICADOS,5/11/2007,,5/11/2007
3008,PROCEDIMENTO ODONTOLÓGICO INCLUSO NO PROCEDIMENTO PRINCIPAL,5/1/2016,,7/31/2016
3009,COBRANÇA DE PROCEDIMENTO ODONTOLÓGICO NÃO EXECUTADO,5/11/2007,,5/11/2007
3010,COBRANÇA DE PROCEDIMENTO NÃO SOLICITADO PELO CIRURGIÃO-DENTISTA,5/11/2007,,5/11/2007
3011,PROCEDIMENTO ODONTOLÓGICO SEM REGISTRO DE EXECUÇÃO,5/11/2007,,5/11/2007
3012,COBRANÇA DE PROCEDIMENTO ODONTOLÓGICO NÃO CORRELACIONADO AO RELATÓRIO ESPECÍFICO,5/11/2007,,5/11/2007
3013,COBRANÇA DE PROCEDIMENTO ODONTOLÓGICO SEM JUSTIFICATIVA PARA REALIZAÇÃO OU COM JUSTIFICATIVA INSUFICIENTE.,5/11/2007,,5/11/2007
3014,COBRANÇA DE PROCEDIMENTO ODONTOLÓGICO COM DATA DE AUTORIZAÇÃO POSTERIOR À DO ATENDIMENTO.,5/11/2007,,5/11/2007
3015,COBRANÇA DE PROCEDIMENTO ODONTOLÓGICO COM AUSÊNCIA DE RESULTADO OU LAUDO TÉCNICO.,5/11/2007,,5/11/2007
3016,"PROCEDIMENTO ODONTOLÓGICO REALIZADO, NA MESMA ESPECIALIDADE, NO PRAZO INFERIOR AO ESTIPULADO, SEM JUSTIFICATIVA",5/1/2016,,7/31/2016
3017,PROCEDIMENTO COBRADO NÃO CORRESPONDE A PERÍCIA (ESPECIFICAR).,5/11/2007,,5/11/2007
3018,EVENTO GLOSADO POR AUDITORIA (ESPECIFICAR),5/11/2007,,5/11/2007
3019,"EVENTO SOB ANÁLISE TÉCNICA, AGUARDANDO LIBERAÇÃO DE CONFIRMAÇÃO PARA POSTERIOR PAGAMENTO",5/11/2007,,5/11/2007
3020,"CONFORME DOCUMENTAÇÃO RADIOGRÁFICA ENVIADA, EVENTO REALIZADO INADEQUADAMENTE",5/11/2007,,5/11/2007
3021,FALHA EM INFORMAÇÃO DE DADOS DE ARCADAS/HEMI-ARCOS,5/11/2007,,5/11/2007
3022,FALHA EM INFORMAÇÃO DE DADOS DE DENTE INICIAL E/OU FINAL,5/11/2007,,5/11/2007
3023,FALHA EM INFORMAÇÃO DE DADOS DE FACES DOS DENTES,5/11/2007,,5/11/2007
3024,EVENTO SÓ POSSÍVEL EM DENTES DECÍDUOS,5/11/2007,,5/11/2007
3025,EVENTO SÓ POSSÍVEL EM DENTES PERMANENTES,5/11/2007,,5/11/2007
3026,ERRO NAS INFORMAÇÕES DE ORDEM DOS DENTES INICIAL E FINAL,5/11/2007,,5/11/2007
3027,DESACORDO ENTRE O TIPO DE DENTE E O NÚMERO DE CANAIS SOLICITADOS,5/11/2007,,5/11/2007
3028,EVENTO RESTRITO À ESPECIALISTAS,5/11/2007,,5/11/2007
3029,EVENTO NÃO INDICADO PELA AUDITORIA INICIAL,5/11/2007,,5/11/2007
3030,AUDITORIA FINAL CONSTA QUE A RESTAURAÇÃO FOI REALIZADA EM OUTRO MATERIAL,5/11/2007,,5/11/2007
3031,RADIOGRAFIA FORA DOS PADRÕES TÉCNICOS,5/11/2007,,5/11/2007
3032,INTERVALO DA ÚLTIMA MPP INFERIOR A TRÊS MESES,5/11/2007,,5/11/2007
3033,INTERVALO DA ÚLTIMA MPP INFERIOR A QUATRO MESES,5/11/2007,,5/11/2007
3034,JUSTIFICATIVA TECNICAMENTE NÃO SATISFATÓRIA,5/11/2007,,5/11/2007
3035,PACIENTE EM TRATAMENTO COM O MESMO PROFISSIONAL,5/11/2007,,5/11/2007
3036,PACIENTE EM TRATAMENTO COM OUTRO PROFISSIONAL,5/11/2007,,5/11/2007
3037,PROCEDIMENTO COBRADO NÃO É IGUAL AO EXECUTADO ,5/11/2007,,5/11/2007
3038,RADIOGRAFIA INICIAL INCONGRUENTE COM A RADIOGRAFIA FINAL,5/11/2007,,5/11/2007
3039,RADIOGRAFIA NÃO CORRESPONDE AO PROCEDIMENTO COBRADO,5/11/2007,,5/11/2007
3040,GLOSA TÉCNICA (ESPECIFICAR DETALHADAMENTE),5/11/2007,,5/11/2007
3041,AGUARDANDO DOCUMENTAÇÃO DE ORTODONTIA,4/1/2013,,8/31/2014
3042,APÓS ANÁLISE DA RADIOGRAFIA INICIAL VERIFICOU-SE EXODONTIA DE INCLUSO,4/1/2013,,8/31/2014
3043,APÓS ANÁLISE DA RADIOGRAFIA INICIAL VERIFICOU-SE EXODONTIA DE SEMI-INCLUSO,4/1/2013,,8/31/2014
3044,APÓS ANÁLISE DA RADIOGRAFIA INICIAL VERIFICOU-SE EXODONTIA SIMPLES,4/1/2013,,8/31/2014
3045,"APÓS ANÁLISE DA RADIOGRAFIA INICIAL, VERIFICOU-SE EXODONTIA DE FRAGMENTO RADICULAR",4/1/2013,,8/31/2014
3046,AUDITORIA FINAL CONSTA QUE O PROCEDIMENTO FOI REALIZADO COM OUTRO MATERIAL ,4/1/2013,,8/31/2014
3047,AUSÊNCIA DE IMAGEM/FOTO/RADIOGRAFIA/ DIAGNÓSTICO PÓS PROCEDIMENTO ODONTOLÓGICO,4/1/2013,,8/31/2014
3048,CANCELAMENTO DO PROCEDIMENTO ODONTOLÓGICO POR SOLICITAÇÃO DO BENEFICIÁRIO.,4/1/2013,,8/31/2014
3049,CANCELAMENTO DO PROCEDIMENTO ODONTOLÓGICO POR SOLICITAÇÃO DO PRESTADOR.,4/1/2013,,8/31/2014
3050,COBRANÇA DE URGÊNCIA/EMERGÊNCIA NA VIGÊNCIA DO TRATAMENTO ODONTOLÓGICO.,4/1/2013,,8/31/2014
3051,DOCUMENTAÇÃO EM ANÁLISE,4/1/2013,,8/31/2014
3052,"DOCUMENTAÇÃO INCOMPLETA, INCORRETA OU AUSENTE",4/1/2013,,8/31/2014
3053,ELEMENTOS PODEM SER VISUALIZADOS EM UMA MESMA PELÍCULA.,4/1/2013,,8/31/2014
3054,IDENTIFICADO CONDUTO(S) NÃO OBTURADO(S),4/1/2013,,8/31/2014
3055,IDENTIFICADO TRATAMENTO ENDODÔNTICO E NÃO RETRATAMENTO,4/1/2013,,8/31/2014
3056,NA AUDITORIA FOI CONSTATADA DIVERGÊNCIA NA QUANTIDADE DE FACES RESTAURADAS,4/1/2013,,8/31/2014
3057,NÃO APRESENTA A QUANTIDADE MÍNIMA DE ELEMENTOS DENTÁRIOS POR SEGMENTO,4/1/2013,,8/31/2014
3058,NECESSÁRIA AUDITORIA FINAL,4/1/2013,,8/31/2014
3059,NECESSÁRIA AUDITORIA INICIAL,4/1/2013,,8/31/2014
3060,NECESSÁRIA AUDITORIA INTERMEDIÁRIA,4/1/2013,,8/31/2014
3061,NECESSÁRIA AVALIAÇÃO DO ESPECIALISTA,4/1/2013,,8/31/2014
3062,NECESSÁRIO ENVIAR LAUDO OU RELATÓRIO TÉCNICO SOBRE O TRATAMENTO SOLICITADO.,4/1/2013,,8/31/2014
3063,O PLANO DE TRATAMENTO AUTORIZADO SERÁ CANCELADO DEVIDO À TROCA DE PROFISSIONAL,4/1/2013,,8/31/2014
3064,PROCEDIMENTO AUTORIZADO APENAS PARA DENTES TRATADOS ENDODONTICAMENTE,4/1/2013,,8/31/2014
3065,PROCEDIMENTO AUTORIZADO SOMENTE PARA DENTES ANTERIORES,4/1/2013,,8/31/2014
3066,PROCEDIMENTO EM DESACORDO COM O ANEXO GUIA TRATAMENTO ODONTOLÓGICO SITUAÇÃO INICIAL,4/1/2013,,8/31/2014
3067,RADIOGRAFIA FINAL NÃO ENVIADA,4/1/2013,,8/31/2014
3068,RADIOGRAFIA FINAL SEM DISSOCIAÇÃO DOS CONDUTOS,4/1/2013,,8/31/2014
3069,RADIOGRAFIA INDICA A NECESSIDADE DE TRATAMENTO ENDODONTICO,4/1/2013,,8/31/2014
3070,RADIOGRAFIA INDICA A PRESENÇA DE RAIZ RESIDUAL NO ALVEOLO,4/1/2013,,8/31/2014
3071,RADIOGRAFIA INDICA AUSENCIA DE NÚCLEO,4/1/2013,,8/31/2014
3072,RADIOGRAFIA INDICA CANAL(AIS) NÃO OBTURADO(S),4/1/2013,,8/31/2014
3073,RADIOGRAFIA INDICA DESVIO DA TRAJETORIA DO CANAL ,4/1/2013,,8/31/2014
3074,RADIOGRAFIA INDICA EXCESSO DE MATERIAL,4/1/2013,,8/31/2014
3075,RADIOGRAFIA INDICA FALHA NA OBTURAÇÃO DO(S) CONDUTO(S),4/1/2013,,8/31/2014
3076,RADIOGRAFIA INDICA FALTA DE ADAPTAÇÃO DA COROA/NÚCLEO,4/1/2013,,8/31/2014
3077,RADIOGRAFIA INDICA FALTA DE ADAPTAÇÃO DA COROA/PEÇA PROTÉTICA,4/1/2013,,8/31/2014
3078,RADIOGRAFIA INDICA NÚCLEO INADEQUADO,4/1/2013,,8/31/2014
3079,RADIOGRAFIA INDICA TRATAMENTO ENDODÔNTICO E NÃO RETRATATAMENTO  ENDODÔNTICO,4/1/2013,,8/31/2014
3080,RADIOGRAFIA INICIAL E FINAL NÃO ENVIADAS,5/1/2014,,8/31/2014
3081,RADIOGRAFIA INICIAL NÃO ENVIADA,4/1/2013,,8/31/2014
3082,RADIOGRAFIA/IMAGEM INDICA FALHA NA RESTAURAÇÃO,4/1/2013,,8/31/2014
3083,"REAVALIAR O PLANO DE TRATAMENTO OBSERVANDO CRITÉRIOS DE INDICAÇÃO, OPORTUNIDADE E VIABILIDADE.",4/1/2013,,8/31/2014
3084,RELATÓRIO ANALISE TÉCNICA SEM CARIMBO/ASSINATURA DO  PRESTADOR,4/1/2013,,8/31/2014
3085,RADIOGRAFIA NÃO CORRESPONDE AO PROCEDIMENTO SOLICITADO,4/1/2013,,8/31/2014
3086,TRATAMENTO ODONTOLÓGICO NÃO CARACTERIZADO COMO URGÊNCIA.,4/1/2013,,8/31/2014
3087,COBRANÇA INDEVIDA DE TAXA ADMINISTRATIVA,5/1/2016,,7/31/2016
3088,"VALOR ACATADO, CONFORME REAJUSTE RETROATIVO",5/1/2016,,7/31/2016
3089,QUANTIDADE DE ITENS INCOMPATÍVEL COM O PERÍODO DE INTERNAÇÃO,5/1/2016,,7/31/2016
3090,NECESSÁRIO ENVIAR AS ETIQUETAS E SELOS HEMOTERÁPICOS DO MATERIAL UTILIZADO,5/1/2016,,7/31/2016
3091,COBRANÇA FORA DO PRAZO ESTIPULADO NO CONTRATO,5/1/2016,,7/31/2016
3092,"VALOR ACATADO POR GLOSA REALIZADA INDEVIDAMENTE, APÓS AVALIAÇÃO DO RECURSO",5/1/2016,,7/31/2016
3093,VALOR ACATADO POR AUTORIZAÇÃO ESPECIAL,5/1/2016,,7/31/2016
3094,VALOR DA TAXA ADMINISTRATIVA ALTERADO EM RAZÃO DE GLOSAS,5/1/2016,,7/31/2016
3095,RECURSO DE GLOSA ACATADO,5/1/2016,,7/31/2016
3096,ATENDIMENTO NÃO CONFIRMADO PELO BENEFICIÁRIO,5/1/2016,,7/31/2016
3097,TIPO DE ATENDIMENTO INCOMPATÍVEL COM A SEGMENTAÇÃO ASSISTENCIAL CONTRATADA,5/1/2016,,7/31/2016
3098,O PRESTADOR POSSUI PACOTE CONTRATADO PARA ESTE PROCEDIMENTO. VERIFIQUE O CÓDIGO CORRESPONDENTE,5/1/2016,,7/31/2016
3100,"PARA LIBERAR ESTE ACESSO, ENTRE EM CONTATO COM A OPERADORA E SOLICITE O CADASTRAMENTO DO SEU CÓDIGO DE ORIGEM",5/1/2016,,7/31/2016
3101,O PROCEDIMENTO SOLICITADO É DE EXECUÇÃO ÚNICA E JÁ FOI REALIZADO PELO BENEFICIÁRIO,5/1/2016,,7/31/2016
3102,É NECESSÁRIO TER UM PROCEDIMENTO RELACIONADO À SOLICITAÇÃO,5/1/2016,,7/31/2016
3103,SOLICITAÇÃO DE AUTORIZAÇÃO FORA DO PRAZO ACORDADO,5/1/2016,,7/31/2016
3104,"RECUSADO, CONFORME JUNTA MÉDICA/ODONTOLÓGICA",5/1/2016,,7/31/2016
3105,ITEM COM UTILIZAÇÃO SUSPENSA PELO ÓRGÃO COMPETENTE,5/1/2016,,7/31/2016
3106,REGISTRO ANVISA INVÁLIDO OU NÃO INFORMADO,5/1/2016,,7/31/2016
3107,ITEM CATEGORIZADO COMO NÃO DESCARTÁVEL,5/1/2016,,7/31/2016
3108,ITEM INCLUSO NO PACOTE NEGOCIADO,5/1/2016,,7/31/2016
3109,PROCEDIMENTO SOLICITADO NÃO AUTORIZADO POR NÃO CONSTAR DO ROL DE PROCEDIMENTOS E EVENTOS EM SAÚDE DA ANS,5/1/2016,,7/31/2016
3110,BLOQUEIO JUDICIAL,5/1/2016,,7/31/2016
3111,CAMPO CONDICIONADO NÃO PREENCHIDO OU INCORRETO,5/1/2016,,7/31/2016
3112,DESCONTO DE COPARTICIPAÇÃO/FRANQUIA CONFORME CONTRATO,5/1/2016,,7/31/2016
3113,NECESSÁRIO ENVIO DE  RADIOGRAFIA  PERIAPICAL DA REGIÃO,5/1/2016,,7/31/2016
3114,NECESSÁRIO ENVIO DE RADIOGRAFIA INTERPROXIMAL DA REGIÃO,5/1/2016,,7/31/2016
3115,NECESSÁRIO ENVIO DE RADIOGRAFIA OCLUSAL DA REGIÃO,5/1/2016,,7/31/2016
3116,REALIZAÇÃO DE PROCEDIMENTO COM NECESSIDADE ESTÉTICA,5/1/2016,,7/31/2016
3117,PROCEDIMENTO ODONTOLÓGICO COM INDICAÇÃO TÉCNICA EM PROGNÓSTICO DESFAVORÁVEL,5/1/2016,,7/31/2016
3118,NECESSÁRIO ENVIAR TERMO DE CONSENTIMENTO INFORMADO,5/1/2016,,7/31/2016
3119,NECESSÁRIO ENVIAR TERMO DE RESPONSABILIDADE PROFISSIONAL,5/1/2016,,7/31/2016
3120,NECESSÁRIO O ENVIO DO PEDIDO DO PROFISSIONAL SOLICITANTE,5/1/2016,,7/31/2016
3121,ITEM AUTORIZADO E AINDA NÃO INDENIZADO,5/1/2016,,7/31/2016
3122,SOLICITAÇÃO DE REEMBOLSO EM PLANO SEM DIREITO À LIVRE ESCOLHA,5/1/2016,,7/31/2016
3123,ITEM PARA A MESMA FINALIDADE JÁ AUTORIZADO,5/1/2016,,7/31/2016
3124,RADIOGRAFIA SUGERE INDICAÇÃO DE EXODONTIA,5/1/2016,,7/31/2016
3125,RADIOGRAFIA SUGERE INDICAÇÃO DE RETRATAMENTO ENDODONTICO,5/1/2016,,7/31/2016
3126,COBRANÇA DE ITEM ANTERIOR À DATA DE REALIZAÇÃO,5/1/2016,,7/31/2016
3127,IMAGEM SUGERE ALTERAÇÃO PATOLÓGICA,5/1/2016,,7/31/2016
3128,IMAGEM SUGERE PRESENÇA DE ARTEFATO DE IMAGEM,5/1/2016,,7/31/2016
3129,IMAGEM SUGERE PRESENÇA DE CORPO ESTRANHO,5/1/2016,,7/31/2016
3130,IMAGEM SUGERE IMPLANTE EM PROCESSO DE OSSEOINTEGRAÇÃO,5/1/2016,,7/31/2016
3131,ENVIAR PLANO DE TRATAMENTO ORTODÔNTICO INICIAL,5/1/2016,,7/31/2016
3132,ENVIAR PLANO DE TRATAMENTO ORTODÔNTICO INTERMEDIÁRIO,5/1/2016,,7/31/2016
3133,TRATAMENTO ORTODÔNTICO CONCLUÍDO,5/1/2016,,7/31/2016
3134,TRATAMENTO ORTODÔNTICO EM  FASE DE CONTENÇÃO,5/1/2016,,7/31/2016
3135,PROFISSIONAL INFORMADO PARA REEMBOLSO PERTENCE A REDE DA OPERADORA,5/1/2016,,7/31/2016
3136,PROCEDIMENTO OU ITEM ASSISTENCIAL AUTORIZADO,5/1/2016,,7/31/2016
3137,PROCEDIMENTO PREVÊ COPARTICIPAÇÃO/FRANQUIA CONFORME CONTRATO,5/1/2016,,7/31/2016
3138,CONDIÇÃO CLÍNICA INCOMPATÍVEL COM A SOLICITAÇÃO,5/1/2016,,7/31/2016
3139,TRATAMENTO ORTODONTICO SUSPENSO A PEDIDO DO DENTISTA,5/1/2016,,7/31/2016
3140,ABANDONO DE TRATAMENTO PELO BENEFICIÁRIO,5/1/2016,,7/31/2016
3141,BENEFICIÁRIO NÃO POSSUI COBERTURA PARA ASSISTÊNCIA AMBULATORIAL,5/1/2016,,7/31/2016
3142,ITEM NÃO CONTRATADO,5/1/2016,,7/31/2016
3143,VALOR ACATADO POR DECISÃO JUDICIAL /LIMINAR,5/1/2016,,7/31/2016
3144,NÃO É NECESSÁRIA AUTORIZAÇÃO PRÉVIA,5/1/2016,,7/31/2016
3145,NÃO AUTORIZADO POR MOTIVO TÉCNICO,5/1/2016,,7/31/2016
3146,"PRODUTO CONTRATADO NÃO ADAPTADO À LEI 9.656/98, SEM COBERTURA CONTRATUAL PARA O ITEM SOLICITADO",5/1/2016,,7/31/2016
3147,MATERIAL PASSÍVEL DE REPROCESSAMENTO,5/1/2016,,7/31/2016
3148,TIPO DE TRANSAÇÃO INVÁLIDO,5/1/2016,,7/31/2016
3149,INDICADOR DE ENVIO EM PAPEL INVÁLIDO,5/1/2016,,7/31/2016
3150,CÓDIGO DA TABELA INVÁLIDO,5/1/2016,,7/31/2016
3151,O ESTABELECIMENTO DE SAÚDE PARA O QUAL FOI SOLICITADA A INFORMAÇÃO SOBRE PARTOS NÃO POSSUÍA VÍNCULO COM A OPERADORA NO PERÍODO A QUE SE REFERE A INFORMAÇÃO,5/1/2016,,7/31/2016
3152,O PROFISSIONAL PARA O QUAL FOI SOLICITADA A INFORMAÇÃO SOBRE PARTOS NÃO POSSUÍA VÍNCULO COM A OPERADORA NO PERÍODO A QUE SE REFERE A INFORMAÇÃO,5/1/2016,,7/31/2016
3153,O ESTABELECIMENTO DE SAÚDE PARA O QUAL FOI SOLICITADA A INFORMAÇÃO SOBRE PARTOS NÃO POSSUI VÍNCULO COM A OPERADORA,5/1/2016,,7/31/2016
3154,O PROFISSIONAL PARA O QUAL FOI SOLICITADA A INFORMAÇÃO SOBRE PARTOS NÃO POSSUI VÍNCULO COM A OPERADORA,5/1/2016,,7/31/2016
3155,PARTOGRAMA OU RELATÓRIO MÉDICO NÃO DISPONÍVEL PARA CONSULTA DA OPERADORA,5/1/2016,,7/31/2016
5001,MENSAGEM ELETRÔNICA FORA DO PADRÃO TISS,11/16/2006,,11/16/2006
5002,NÃO FOI POSSÍVEL VALIDAR O ARQUIVO XML,11/16/2006,,11/16/2006
5003,ENDEREÇO DO REMETENTE INVÁLIDO,11/16/2006,,11/16/2006
5004,ENDEREÇO DO DESTINATÁRIO INVÁLIDO,11/16/2006,,11/16/2006
5005,REMETENTE NÃO IDENTIFICADO,11/16/2006,,11/16/2006
5006,DESTINATÁRIO NÃO IDENTIFICADO,11/16/2006,,11/16/2006
5007,MENSAGEM INCONSISTENTE OU INCOMPLETA,11/16/2006,,11/16/2006
5008,ESPAÇO RESERVADO PARA A CAIXA DE SAÍDA INSUFICIENTE,11/16/2006,,11/16/2006
5009,ESPAÇO RESERVADO PARA A CAIXA DE ENTRADA INSUFICIENTE,11/16/2006,,11/16/2006
5010,ENVIO DE MENSAGEM NÃO FOI TERMINADO,11/16/2006,,11/16/2006
5011,ENVIO DE MENSAGEM FINALIZADA,11/16/2006,,11/16/2006
5012,RECEBIMENTO DE MENSAGEM NÃO FINALIZADO,11/16/2006,,11/16/2006
5013,RECEBIMENTO DE MENSAGEM FINALIZADA,11/16/2006,,11/16/2006
5014,CÓDIGO HASH INVÁLIDO. MENSAGEM PODE ESTAR CORROMPIDA.,11/16/2006,,11/16/2006
5015,NÚMERO DE GUIAS/DEMONSTRATIVOS DENTRO DA MENSAGEM SUPERIOR AO TAMANHO MÁXIMO PERMITIDO.,10/29/2007,,10/29/2007
5016,SEM NENHUMA OCORRENCIA DE MOVIMENTO NA COMPETENCIA PARA ENVIO A ANS,5/1/2014,,8/31/2014
5017,ARQUIVO PROCESSADO PELA ANS,12/1/2013,,8/31/2014
5018,CERTIFICADO DIGITAL INVÁLIDO,5/1/2014,,8/31/2014
5019,CERTIFICADO DIGITAL VENCIDO,5/1/2014,,8/31/2014
5020,CERTIFICADO DIGITAL REVOGADO,5/1/2014,,8/31/2014
5021,CADEIA DE CERTIFICAÇÃO INVÁLIDA,5/1/2014,,8/31/2014
5022,ASSINATURA DIGITAL NÃO CONFERE,5/1/2014,,8/31/2014
5023,COMPETÊNCIA NÃO ESTÁ LIBERADA PARA ENVIO DE DADOS,5/1/2014,,8/31/2014
5024,OPERADORA INATIVA NA COMPETÊNCIA DOS DADOS,5/1/2014,,8/31/2014
5025,DATA DE REGISTRO DA TRANSAÇÃO INVÁLIDA,5/1/2014,,8/31/2014
5026,HORA DE REGISTRO DA TRANSAÇÃO INVÁLIDA,5/1/2014,,8/31/2014
5027,REGISTRO ANS DA OPERADORA INVÁLIDO,5/1/2014,,8/31/2014
5028,VERSÃO DO PADRÃO INVÁLIDA,5/1/2014,,8/31/2014
5029,INDICADOR INVÁLIDO,5/1/2014,,8/31/2014
5030,CÓDIGO DO MUNÍCIPIO INVÁLIDO,5/1/2014,,8/31/2014
5031,CARÁTER DE ATENDIMENTO INVÁLIDO,5/1/2014,,8/31/2014
5032,INDICADOR DE RECÉM-NATO INVÁLIDO,5/1/2014,,8/31/2014
5033,MOTIVO DE ENCERRAMENTO INVÁLIDO,5/1/2014,,8/31/2014
5034,VALOR NÃO INFORMADO,5/1/2014,,8/31/2014
5035,CÓDIGO DA TABELA DE REFERÊNCIA NÃO INFORMADO,5/1/2014,,8/31/2014
5036,CÓDIGO DO GRUPO DO PROCEDIMENTO INVÁLIDO,5/1/2014,,8/31/2014
5037,CÓDIGO DO DENTE INVÁLIDO,5/1/2014,,8/31/2014
5038,CÓDIGO DA REGIÃO DA BOCA INVÁLIDO,5/1/2014,,8/31/2014
5039,CÓDIGO DA FACE DO DENTE INVÁLIDO,5/1/2014,,8/31/2014
5040,VALOR DEVE SER MAIOR QUE ZERO,5/1/2014,,8/31/2014
5041,QUANTIDADE NÃO INFORMADA,5/1/2014,,8/31/2014
5042,VALOR INFORMADO DA GUIA DIFERENTE DO SOMATÓRIO DO VALOR INFORMADO DOS ITENS,5/1/2014,,8/31/2014
5043,MOTIVO INVÁLIDO,5/1/2014,,8/31/2014
5044,JÁ EXISTEM INFORMAÇÕES NA ANS PARA A COMPETÊNCIA INFORMADA,5/1/2014,,8/31/2014
5045,COMPETÊNCIA ANTERIOR NÃO ENVIADA,5/1/2014,,8/31/2014
5046,COMPETÊNCIA INVÁLIDA,5/1/2014,,8/31/2014
5047,NÚMERO DO LOTE NÃO INFORMADO,5/1/2016,,7/31/2016
5048,DATA DE NASCIMENTO DO BENEFICIÁRIO INVÁLIDA,5/1/2016,,7/31/2016
5049,VALOR TOTAL MENOR QUE ZERO NA GUIA,5/1/2016,,7/31/2016
5050,VALOR INFORMADO INVÁLIDO,5/1/2016,,7/31/2016
5051,COMPETENCIA DO ARQUIVO DIFERENTE DA COMPETENCIA DA DATA DE PROCESSAMENTO DO LANÇAMENTO,5/1/2016,,7/31/2016
5052,IDENTIFICADOR INEXISTENTE,5/1/2016,,7/31/2016
5053,IDENTIFICADOR JÁ INFORMADO,5/1/2016,,7/31/2016
5054,IDENTIFICADOR NÃO ENCONTRADO,5/1/2016,,7/31/2016
5055,IDENTIFICADOR JÁ INFORMADO NA COMPETÊNCIA,5/1/2016,,7/31/2016
5056,IDENTIFICADOR NÃO INFORMADO NA COMPETÊNCIA,5/1/2016,,7/31/2016
5057,GUIA DE CONSULTA COM MAIS DE UM PROCEDIMENTO,5/1/2016,,7/31/2016
5058,PROCEDIMENTO INCOMPATÍVEL COM O TIPO DE GUIA,5/1/2016,,7/31/2016
5059,EXCLUSÃO INVÁLIDA - EXISTEM LANÇAMENTOS VINCULADOS A ESTA FORMA DE CONTRATAÇÃO,5/1/2016,,7/31/2016
5060,VALOR TOTAL PAGO DIFERENTE DA SOMA DAS PARCELAS PAGAS NO LANÇAMENTO,5/1/2016,,7/31/2016
5061,TIPO DE ATENDIMENTO OPERADORA INTERMEDIÁRIA NÃO INFORMADO,1/1/2018,,3/31/2018
5062,REGISTRO ANS DA OPERADORA INTERMEDIÁRIA NÃO INFORMADO,1/1/2018,,3/31/2018
3156,Token inválido,3/1/2019,,2/29/2020
3157,QR code inválido,3/1/2019,,2/29/2020
3158,Biometria – falha na transmissão,3/1/2019,,2/29/2020
3159,Biometria – não compatível,3/1/2019,,2/29/2020
3160,Time Out - tente novamente,8/1/2021,,4/30/2023
3161,Prazo de envio fora do período contratual acordado entre as partes,8/1/2021,,4/30/2023
3162,Código do protocolo não encontrado,8/1/2021,,4/30/2023
3163,Não necessita de imagem,8/1/2021,,4/30/2023
3164,Arquivo enviado não é de imagem,8/1/2021,,4/30/2023
3165,Arquivo de imagem corrompido,8/1/2021,,4/30/2023
3166,Arquivo enviado excede o tamanho máximo permitido,8/1/2021,,4/30/2023
3167,SEQUENCIAL INVÁLIDO,10/1/2022,,4/30/2023
3168,ASSINATURA DIGITAL INVÁLIDA OU NÃO ENVIADA,10/1/2022,,4/30/2023
5063,PAR CNPJ x CNES NAO ENCONTRADO NA BASE DO CNES,10/1/2022,,4/30/2023
5064,TIPO DE ESTABELECIMENTO NO CNES NÃO É APTO PARA INTERNAÇÃO,10/1/2022,,4/30/2023
5065,TIPO DE ATIVIDADE ECONOMICA DO CNPJ NÃO É APTO PARA INTERNAÇÃO,10/1/2022,,4/30/2023
5066,NÚMERO DA DECLARAÇÃO EM DUPLICIDADE.,10/1/2022,,4/30/2023
5067,DIAGNÓSTICO EM DUPLICIDADE,10/1/2022,,4/30/2023
5068,DECLARAÇÃO DIFERENTE DO LANÇAMENTO ANTERIOR DA GUIA,10/1/2022,,4/30/2023
5069,CÓDIGO DO DENTE DIFERENTE DO LANÇAMENTO ANTERIOR DA GUIA,10/1/2022,,4/30/2023
5070,CÓDIGO DA REGIÃO DA BOCA DIFERENTE DO LANÇAMENTO ANTERIOR DA GUIA,10/1/2022,,4/30/2023
5071,CÓDIGO DA FACE DO DENTE DIFERENTE DO LANÇAMENTO ANTERIOR DA GUIA,10/1/2022,,4/30/2023
5072,VALOR INFORMADO DIFERENTE DO LANÇAMENTO ANTERIOR DA GUIA,10/1/2022,,4/30/2023
5073,O PRIMEIRO LANCAMENTO DA GUIA SÓ PODE SER EXCLUIDO SE ELE FOR O ÚNICO,10/1/2022,,4/30/2023
5074,REGIME DE ATENDIMENTO INVÁLIDO,10/1/2022,,4/30/2023
5075,CID DIFERENTE DO LANÇAMENTO ANTERIOR DA GUIA,10/1/2022,,4/30/2023
5076,CPF NÃO ENCONTRADO NA RECEITA FEDERAL,10/1/2022,,4/30/2023
5077,SEXO NA RECEITA FEDERAL DIFERENTE DO INFORMADO PARA O CPF,10/1/2022,,4/30/2023
5078,DATA DE NASCIMENTO NA RECEITA FEDERAL DIFERENTE DA INFORMADA PARA O CPF,10/1/2022,,4/30/2023
5079,MODELO DE REMUNERAÇÃO EM DUPLICIDADE.,10/1/2022,,4/30/2023
5080,MODELO DE REMUNERAÇÃO NÃO INFORMADO,10/1/2022,,4/30/2023
5081,MODELO DE REMUNERAÇÃO NÃO DEVE SER INFORMADO PARA REEMBOLSO/PRESTADOR EVENTUAL,10/1/2022,,4/30/2023
5082,MODELO DE REMUNERAÇÃO NÃO DEVE SER INFORMADO PARA REDE PROPRIA COM MESMO CNPJ,10/1/2022,,4/30/2023
